{
  "surface": "tree",
  "version": 1,
  "title": "AI Engineering — external courses & certifications",
  "subtitle": "Grouped by institution, and marked with the certification each resource officially prepares for. Every certification fact here was read off the vendor's own page or exam guide on the date shown; anything unconfirmed says so.",
  "groups": [
    {
      "id": "anthropic",
      "label": "Anthropic",
      "accent": "3",
      "description": "Claude Code, Agent SDK, Claude API, MCP."
    },
    {
      "id": "google",
      "label": "Google Cloud",
      "accent": "1",
      "description": "Gemini platform, Vertex/Agent platform, business-level gen AI."
    },
    {
      "id": "aws",
      "label": "AWS",
      "accent": "6",
      "description": "Bedrock, SageMaker, ML operations."
    },
    {
      "id": "microsoft",
      "label": "Microsoft",
      "accent": "8",
      "description": "Azure AI — currently in transition."
    },
    {
      "id": "independent",
      "label": "Independent",
      "accent": "2",
      "description": "Vendor-neutral course providers."
    }
  ],
  "nodes": [
    {
      "id": "anthropic",
      "label": "Anthropic",
      "group": "anthropic",
      "kind": "branch",
      "badges": [
        "2 certifications"
      ],
      "detail": {
        "summary": "The only vendor whose certification maps directly onto the tools already in daily use here — Claude Code, the Agent SDK, the Claude API and MCP. Two tiers, both introduced with version 1.0 effective July 2026.",
        "meta": [
          {
            "label": "Certification tiers",
            "value": "Foundations, Professional"
          },
          {
            "label": "Validity",
            "value": "12 months (both)"
          },
          {
            "label": "Recommendation",
            "value": "Foundations first"
          }
        ],
        "body": [
          {
            "type": "callout",
            "tone": "warning",
            "text": "Several third-party study sites publish blueprints for these exams. At least one set matched the official weights on inspection — which is not a reason to trust the next one. Use the exam guide PDFs only."
          }
        ]
      },
      "children": [
        {
          "id": "ccar-f",
          "label": "Claude Certified Architect – Foundations",
          "group": "anthropic",
          "kind": "leaf",
          "badges": [
            "CCAR-F",
            "$125",
            "60 items"
          ],
          "detail": {
            "summary": "Validates practical judgment about architecture, configuration and tradeoffs when building production applications with Claude. Scenario-based: four scenarios drawn at random from a bank of six.",
            "meta": [
              {
                "label": "Exam code",
                "value": "CCAR-F"
              },
              {
                "label": "Version",
                "value": "1.0 · effective July 2026"
              },
              {
                "label": "Items",
                "value": "60"
              },
              {
                "label": "Time limit",
                "value": "120 minutes"
              },
              {
                "label": "Passing score",
                "value": "720 on a 100–1,000 scale"
              },
              {
                "label": "Fee",
                "value": "$125 USD"
              },
              {
                "label": "Validity",
                "value": "12 months from award"
              },
              {
                "label": "Delivery",
                "value": "Proctored — online and/or test centre"
              },
              {
                "label": "Prerequisites",
                "value": "None stated; 6+ months hands-on recommended"
              }
            ],
            "body": [
              {
                "type": "heading",
                "text": "Domain weights"
              },
              {
                "type": "list",
                "ordered": true,
                "items": [
                  "Agentic Architecture & Orchestration — 27%",
                  "Tool Design & MCP Integration — 18%",
                  "Claude Code Configuration & Workflows — 20%",
                  "Prompt Engineering & Structured Output — 20%",
                  "Context Management & Reliability — 15%"
                ]
              },
              {
                "type": "text",
                "text": "Item format is multiple-choice and multiple-response, with each item stating how many responses to select. Results report pass/fail with a scaled score plus percent-correct by domain."
              },
              {
                "type": "callout",
                "tone": "note",
                "text": "The guide's section 8 contains four hands-on preparation exercises — a multi-tool agent with escalation logic, a team Claude Code configuration, a structured extraction pipeline, and a multi-agent research pipeline. They are the fastest route through the blueprint."
              }
            ],
            "resources": [
              {
                "type": "exam-guide",
                "title": "Claude Certified Architect – Foundations Exam Guide (v1.0)",
                "url": "https://anthropic-partners.skilljar.com/claude-certified-architect-foundations-certification",
                "artifact_url": "https://everpath-course-content.s3-accelerate.amazonaws.com/instructor/6nizmqk8tpzpfjvt6qmmav7rh/public/1783542750/Claude+Certified+Architect+%E2%80%93+Foundations+Exam+Guide.pdf",
                "institution": "Anthropic",
                "certification": "Claude Certified Architect – Foundations",
                "cost": "free",
                "verified_at": "2026-08-16",
                "note": "Landing page is the durable citation; the S3 PDF link carries a numeric path segment and may rotate. Every figure above was read from the PDF itself.",
                "lifecycle": "current",
                "provenance": "primary"
              },
              {
                "type": "course",
                "title": "Claude Code in action",
                "url": "https://www.anthropic.com/learn",
                "institution": "Anthropic Academy",
                "cost": "free",
                "note": "Certificate on completion. Maps to the Claude Code Configuration & Workflows domain (20%).",
                "verified_at": "2026-08-16",
                "provenance": "primary"
              }
            ]
          }
        },
        {
          "id": "ccar-p",
          "label": "Claude Certified Architect – Professional",
          "group": "anthropic",
          "kind": "leaf",
          "badges": [
            "CCAR-P",
            "$175",
            "63 items"
          ],
          "requires": [
            "ccar-f"
          ],
          "detail": {
            "summary": "The architect-level tier, weighted toward integration, solution design and governance rather than hands-on configuration. This is the blueprint nikai's five tracks are built from.",
            "meta": [
              {
                "label": "Exam code",
                "value": "CCAR-P"
              },
              {
                "label": "Version",
                "value": "1.0 · effective July 2026"
              },
              {
                "label": "Items",
                "value": "63"
              },
              {
                "label": "Time limit",
                "value": "120 minutes"
              },
              {
                "label": "Passing score",
                "value": "720 on a 100–1,000 scale"
              },
              {
                "label": "Fee",
                "value": "$175 USD"
              },
              {
                "label": "Validity",
                "value": "12 months from award"
              },
              {
                "label": "Recommended",
                "value": "3+ yrs systems architecture, 6+ months production LLM"
              }
            ],
            "body": [
              {
                "type": "heading",
                "text": "Domain weights"
              },
              {
                "type": "list",
                "ordered": true,
                "items": [
                  "Integration — 19%",
                  "Solution Design & Architecture — 17%",
                  "Evaluation, Testing & Optimization — 16%",
                  "Governance, Safety & Risk Management — 14%",
                  "Stakeholder Communication & Lifecycle Management — 14%",
                  "Claude Models, Prompting & Context Engineering — 13%",
                  "Developer Productivity & Operational Enablement — 7%"
                ]
              },
              {
                "type": "callout",
                "tone": "warning",
                "text": "Provenance differs from the Foundations entry above. The $175 fee was read off the Skilljar page on 2026-08-16. The item count, time limit, passing score, validity and domain weights come from the nikai session's own extraction of the Professional exam guide PDF, not from a second reading here. Treat them as high-confidence but single-sourced, and re-check against the PDF before relying on them."
              }
            ],
            "resources": [
              {
                "type": "exam-guide",
                "title": "Claude Certified Architect – Professional Exam Guide (v1.0)",
                "url": "https://anthropic-partners.skilljar.com/claude-certified-architect-professional-certification",
                "artifact_url": "https://everpath-course-content.s3-accelerate.amazonaws.com/instructor/6nizmqk8tpzpfjvt6qmmav7rh/public/1783542810/Claude+Certified+Architect+%E2%80%93+Professional+Exam+Guide.pdf",
                "institution": "Anthropic",
                "certification": "Claude Certified Architect – Professional",